{
  "$schema": "../../schemas/case.schema.json",
  "id": "case_001",
  "title": "Go Directly to Jail !",
  "difficulty": 1,

  "summary": "A man is accused of counterfeiting money after being caught trying to pay for a Pastel de Nata with a bill that was discovered to be Monopoly money. The defendant claims the bill is real and that hasn't have a clue of what Monopoly even is. The case is a simple one, but the defendant's insistence on his innocence and the presence of a key witness who has a hidden connection to the case make it an interesting one to solve.",

  "canonical_truth_id": "truth_case_001",
  "_truth_ref": "./truth_case_001.json",
  "_evidence_ref": "./evidences/",
  "_testimonies_ref": "./testimonies/",
  "_witnesses_ref": "./witnesses/",

  "phases": [
    {
      "id": "intro",
      "type": "INTRO",
      "scene": "courtroom_opening"
    },

    {
      "id": "investigation_1",
      "type": "INVESTIGATION",
      "locations": ["coffee_shop"],
      "evidence_unlocks": ["counterfeit_bill", "security_footage"]
    },

    {
      "id": "testimony_1",
      "type": "TESTIMONY",
      "witness_id": "witness_cashier",
      "testimony_id": "testimony_cashier_1"
    },

    {
      "id": "cross_exam_1",
      "type": "CROSS_EXAMINATION",
      "witness_id": "witness_cashier",
      "testimony_id": "testimony_cashier_1",

      "contradictions": [
        {
          "statement_id": "stmt_3",
          "correct_evidence": "security_footage",
          "success": { "next_phase": "argument_1", "penalty": 0 },
          "failure": { "penalty": 1, "judge_response": "generic_penalty" }
        }
      ]
    },

    {
      "id": "argument_1",
      "type": "ARGUMENTATION",
      "note": "Defense attorney presents argument based on cashier cross-examination."
    },

    {
      "id": "judge_reaction_1",
      "type": "JUDGE_REACTION",
      "judge_id": "judge_judy"
    },

    {
      "id": "testimony_2",
      "type": "TESTIMONY",
      "witness_id": "witness_person_in_line",
      "testimony_id": "testimony_person_in_line_1"
    },

    {
      "id": "cross_exam_2",
      "type": "CROSS_EXAMINATION",
      "witness_id": "witness_person_in_line",
      "testimony_id": "testimony_person_in_line_1",

      "contradictions": [
        {
          "statement_id": "stmt_5",
          "correct_evidence": "security_footage",
          "success": { "next_phase": "argument_2", "penalty": 0 },
          "failure": { "penalty": 1, "judge_response": "generic_penalty" }
        }
      ]
    },

    {
      "id": "argument_2",
      "type": "ARGUMENTATION",
      "note": "Defense attorney presents argument based on person_in_line cross-examination."
    },

    {
      "id": "judge_reaction_2",
      "type": "JUDGE_REACTION",
      "judge_id": "judge_judy"
    },

    {
      "id": "final_defense",
      "type": "FINAL_DEFENSE",
      "note": "Defense delivers closing argument summarizing gathered contradictions and evidence."
    },

    {
      "id": "verdict",
      "type": "VERDICT",
      "conditions": {
        "required_contradictions": ["stmt_5"]
      }
    }
  ]
}